{
  "schema_version": "1.0",
  "skill_id": "librarian_archivist",
  "version": "1.0.0",
  "entrypoint": "skills.librarian_archivist:run",
  "input_schema": "schemas/librarian_archivist_input.json",
  "output_schema": "schemas/librarian_archivist_output.json",
  "execution": {
    "timeout_seconds": 30,
    "max_attempts": 3,
    "network_access": false,
    "filesystem_scope": "repository_read_only"
  },
  "capabilities": [
    "unified_asset_ontology",
    "bitemporal_lineage_replay",
    "cross_entity_dependency_mapping",
    "tiered_archival_lifecycle"
  ],
  "side_effect_class": "append_only_audit",
  "authority_level": "proposal_only"
}
